{
  "allowed_independent_paths": [
    {
      "estimator_type": "pio_long_gate_timer_frequency_v1",
      "measurement_backend": "OTIS_TCXO_COUNTER_BACKEND_PIO_LONG_GATE"
    },
    {
      "estimator_type": "fc0_long_gate_frequency_v1",
      "measurement_backend": "OTIS_TCXO_COUNTER_BACKEND_FC0_GPIN0"
    },
    {
      "estimator_type": "authorised_external_frequency_v1",
      "measurement_backend": "AUTHORISED_EXTERNAL_FREQUENCY_COUNTER"
    }
  ],
  "candidate_estimator_type": "pps_gated_ratio_count_v1",
  "count_resolution_edges": 1,
  "duplicate_max_interval_s": 0.1,
  "expected_candidate_backend": "OTIS_TCXO_COUNTER_BACKEND_PPS_GATED_RATIO",
  "maximum_absolute_bias_hz": 0.05,
  "maximum_candidate_jitter_hz": 1.5,
  "maximum_service_plane_mean_shift_hz": 0.05,
  "missing_timeout_s": 2.5,
  "minimum_eligible_windows": 3600,
  "minimum_service_plane_windows_per_segment": 600,
  "minimum_stable_duration_s": 3600.0,
  "nominal_reference_interval_s": 1.0,
  "reference_interval_tolerance_s": 0.2,
  "required_fault_reason_codes": [
    "reference_missing_pps",
    "reference_pps_duplicate",
    "reference_pps_short_interval",
    "reference_pps_long_interval",
    "count_zero"
  ],
  "synthetic_only_fault_reason_codes": [
    "count_saturated"
  ],
  "schema_version": 1
}
